{
  "$schema": "https://json-schema.org/draft/2020-12/schema",
  "$id": "https://velox.dev/schemas/agent-canvas/v1/canvas.schema.json",
  "title": "AgentCanvasDocument",
  "description": "Declarative content for one Agent Canvas desktop widget (schema version 1).",
  "type": "object",
  "required": ["version", "sections"],
  "additionalProperties": false,
  "properties": {
    "version": {
      "type": "integer",
      "const": 1
    },
    "updatedAt": {
      "type": "string",
      "format": "date-time",
      "description": "ISO-8601 timestamp; server may overwrite on write."
    },
    "title": {
      "type": "string",
      "maxLength": 120
    },
    "sections": {
      "type": "array",
      "maxItems": 12,
      "items": { "$ref": "#/$defs/section" }
    }
  },
  "$defs": {
    "section": {
      "oneOf": [
        { "$ref": "#/$defs/header" },
        { "$ref": "#/$defs/text" },
        { "$ref": "#/$defs/metrics" },
        { "$ref": "#/$defs/chart" },
        { "$ref": "#/$defs/list" },
        { "$ref": "#/$defs/image" },
        { "$ref": "#/$defs/spacer" }
      ]
    },
    "header": {
      "type": "object",
      "required": ["type", "text"],
      "additionalProperties": false,
      "properties": {
        "type": { "const": "header" },
        "text": { "type": "string", "minLength": 1, "maxLength": 80 },
        "subtitle": { "type": "string", "maxLength": 120 },
        "priority": {
          "type": "integer",
          "minimum": 0,
          "description": "Lower = more important when the widget clips to size budget."
        }
      }
    },
    "text": {
      "type": "object",
      "required": ["type", "content"],
      "additionalProperties": false,
      "properties": {
        "type": { "const": "text" },
        "content": { "type": "string", "minLength": 1, "maxLength": 2000 }
      }
    },
    "metrics": {
      "type": "object",
      "required": ["type", "items"],
      "additionalProperties": false,
      "properties": {
        "type": { "const": "metrics" },
        "items": {
          "type": "array",
          "minItems": 1,
          "maxItems": 4,
          "items": {
            "type": "object",
            "required": ["label", "value"],
            "additionalProperties": false,
            "properties": {
              "label": { "type": "string" },
              "value": { "type": "string" },
              "trend": { "type": "string" }
            }
          }
        }
      }
    },
    "chart": {
      "type": "object",
      "required": ["type", "chartType", "data"],
      "additionalProperties": false,
      "properties": {
        "type": { "const": "chart" },
        "chartType": {
          "type": "string",
          "enum": ["bar", "line", "pie", "gauge"]
        },
        "title": { "type": "string" },
        "data": {
          "type": "array",
          "minItems": 1,
          "maxItems": 32,
          "items": {
            "type": "object",
            "required": ["label", "value"],
            "additionalProperties": false,
            "properties": {
              "label": { "type": "string" },
              "value": { "type": "number" }
            }
          }
        }
      }
    },
    "list": {
      "type": "object",
      "required": ["type", "items"],
      "additionalProperties": false,
      "properties": {
        "type": { "const": "list" },
        "title": { "type": "string" },
        "items": {
          "type": "array",
          "maxItems": 20,
          "items": {
            "type": "object",
            "required": ["primary"],
            "additionalProperties": false,
            "properties": {
              "primary": { "type": "string" },
              "secondary": { "type": "string" },
              "badge": { "type": "string" }
            }
          }
        }
      }
    },
    "image": {
      "type": "object",
      "required": ["type", "source"],
      "additionalProperties": false,
      "properties": {
        "type": { "const": "image" },
        "source": {
          "type": "string",
          "description": "data:image/...;base64,... or file:// under app data. No remote URLs in v1.",
          "minLength": 1
        },
        "url": {
          "type": "string",
          "description": "Legacy alias for source."
        },
        "caption": { "type": "string" }
      }
    },
    "spacer": {
      "type": "object",
      "required": ["type"],
      "additionalProperties": false,
      "properties": {
        "type": { "const": "spacer" },
        "size": {
          "type": "string",
          "enum": ["sm", "md", "lg"]
        }
      }
    }
  }
}
