{
  "version": 1,
  "updatedAt": "2026-07-24T18:42:00Z",
  "title": "Jira Throughput",
  "sections": [
    {
      "type": "header",
      "text": "Jira Throughput",
      "subtitle": "Last 7 days"
    },
    {
      "type": "metrics",
      "items": [
        { "label": "Tickets Closed", "value": "47", "trend": "+12%" },
        { "label": "Avg Cycle Time", "value": "2.3d", "trend": "-0.4d" },
        { "label": "WIP", "value": "11", "trend": "+1" }
      ]
    },
    {
      "type": "chart",
      "chartType": "bar",
      "title": "Daily Closures",
      "data": [
        { "label": "Mon", "value": 8 },
        { "label": "Tue", "value": 12 },
        { "label": "Wed", "value": 6 },
        { "label": "Thu", "value": 9 },
        { "label": "Fri", "value": 12 }
      ]
    },
    {
      "type": "list",
      "title": "Open High Priority",
      "items": [
        {
          "primary": "API rate limiting",
          "secondary": "ENG-4821",
          "badge": "P1"
        },
        {
          "primary": "Login SSO flake",
          "secondary": "ENG-4902",
          "badge": "P2"
        }
      ]
    },
    {
      "type": "text",
      "content": "Generated by agent for Canvas One demo."
    }
  ]
}
